{
  "$schema": "../schemas/item.schema.json",
  "id": "item_wooden_shield",
  "name": "Wooden Shield",
  "description": "A sturdy wooden shield that provides decent protection.",
  "type": "wearable",
  "stats": {
    "strength": 1,
    "intelligence": 0,
    "dexterity": -1
  },
  "isMagical": false
}